{
	"name": "404 Not Found for missing file",
	"description": "Tests 404 response with RFC 7807 problem details when requested file does not exist",
	"category": "static_files",
	"handler": {
		"route": "/*filepath",
		"method": "GET",
		"middleware": {
			"static_files": {
				"root_dir": "./public",
				"cache_control": "public, max-age=3600"
			}
		}
	},
	"request": {
		"method": "GET",
		"path": "/missing.html"
	},
	"expected_response": {
		"status_code": 404,
		"headers": {
			"Content-Type": "application/problem+json"
		},
		"body": {
			"type": "https://spikard.dev/errors/not-found",
			"title": "Not Found",
			"status": 404,
			"detail": "The requested file '/missing.html' was not found"
		}
	},
	"tags": ["static_files", "middleware", "404", "not_found", "error_handling"],
	"notes": "Returns RFC 7807 problem details. No fallback configured, so missing files return 404"
}
